{
  "$schema": "https://json-schema.org/draft/2020-12/schema",
  "$id": "https://schemas.sovereignops.local/plugin-review/artifact-preview.schema.json",
  "title": "Plugin review artifact preview",
  "type": "object",
  "additionalProperties": false,
  "required": [
    "schemaVersion",
    "generatedAt",
    "workspaceId",
    "reviewId",
    "pluginId",
    "artifactId",
    "localOnly",
    "proposalOnly",
    "fingerprint",
    "sourceFiles",
    "redactions",
    "externalCalls",
    "preview"
  ],
  "properties": {
    "schemaVersion": {
      "type": "string",
      "const": "plugin-review-artifact-preview.v1"
    },
    "generatedAt": {
      "type": "string",
      "pattern": "^\\d{4}-\\d{2}-\\d{2}T\\d{2}:\\d{2}:\\d{2}(?:\\.\\d{3})?Z$"
    },
    "workspaceId": {
      "type": "string",
      "pattern": "^wsp_[A-Za-z0-9_-]{1,88}$"
    },
    "reviewId": {
      "type": "string",
      "pattern": "^prv_[A-Za-z0-9_-]{1,88}$"
    },
    "pluginId": {
      "type": "string",
      "pattern": "^plug_[A-Za-z0-9_-]{1,88}$"
    },
    "artifactId": {
      "type": "string",
      "pattern": "^art_[A-Za-z0-9_-]{1,88}$"
    },
    "localOnly": {
      "type": "boolean",
      "const": true
    },
    "proposalOnly": {
      "type": "boolean",
      "const": true
    },
    "fingerprint": {
      "type": "string",
      "pattern": "^[a-f0-9]{64}$"
    },
    "sourceFiles": {
      "type": "array",
      "minItems": 1,
      "items": {
        "$schema": "https://json-schema.org/draft/2020-12/schema",
        "title": "Plugin review source file",
        "type": "object",
        "additionalProperties": false,
        "required": [
          "id",
          "path",
          "mediaType",
          "role",
          "sha256",
          "byteSize",
          "includedInPreview"
        ],
        "properties": {
          "id": {
            "type": "string",
            "minLength": 1,
            "pattern": "^[A-Za-z][A-Za-z0-9_-]{0,95}$"
          },
          "path": {
            "type": "string",
            "minLength": 1,
            "pattern": "^(?!/)(?![A-Za-z]:)(?!.*(?:^|/)\\.\\.(?:/|$))(?!.*//)[A-Za-z0-9._/-]+$"
          },
          "mediaType": {
            "type": "string",
            "minLength": 1,
            "pattern": "^[^\\s/]+/[^\\s]+$"
          },
          "role": {
            "type": "string",
            "enum": [
              "manifest",
              "entrypoint",
              "source",
              "metadata",
              "asset",
              "test",
              "documentation"
            ]
          },
          "sha256": {
            "type": "string",
            "pattern": "^[a-f0-9]{64}$"
          },
          "byteSize": {
            "type": "integer",
            "minimum": 0
          },
          "includedInPreview": {
            "type": "boolean"
          }
        }
      }
    },
    "redactions": {
      "type": "array",
      "items": {
        "$schema": "https://json-schema.org/draft/2020-12/schema",
        "title": "Plugin review redaction",
        "type": "object",
        "additionalProperties": false,
        "required": [
          "id",
          "sourceFileId",
          "kind",
          "range",
          "replacement",
          "originalFingerprint"
        ],
        "properties": {
          "id": {
            "type": "string",
            "minLength": 1,
            "pattern": "^[A-Za-z][A-Za-z0-9_-]{0,95}$"
          },
          "sourceFileId": {
            "type": "string",
            "minLength": 1,
            "pattern": "^[A-Za-z][A-Za-z0-9_-]{0,95}$"
          },
          "kind": {
            "type": "string",
            "enum": [
              "credential",
              "personalData",
              "internalPath",
              "proprietaryValue"
            ]
          },
          "range": {
            "$schema": "https://json-schema.org/draft/2020-12/schema",
            "title": "Plugin review source range",
            "type": "object",
            "additionalProperties": false,
            "required": [
              "startLine",
              "endLine"
            ],
            "properties": {
              "startLine": {
                "type": "integer",
                "minimum": 1
              },
              "endLine": {
                "type": "integer",
                "minimum": 1
              },
              "startColumn": {
                "type": "integer",
                "minimum": 1
              },
              "endColumn": {
                "type": "integer",
                "minimum": 1
              }
            }
          },
          "replacement": {
            "type": "string",
            "const": "[redacted]"
          },
          "originalFingerprint": {
            "type": "string",
            "pattern": "^[a-f0-9]{64}$"
          }
        }
      }
    },
    "externalCalls": {
      "type": "array",
      "items": {
        "$schema": "https://json-schema.org/draft/2020-12/schema",
        "title": "Plugin review proposed external call",
        "type": "object",
        "additionalProperties": false,
        "required": [
          "id",
          "method",
          "url",
          "purpose",
          "requestedBySourceFileId",
          "proposalOnly",
          "executed"
        ],
        "properties": {
          "id": {
            "type": "string",
            "minLength": 1,
            "pattern": "^[A-Za-z][A-Za-z0-9_-]{0,95}$"
          },
          "method": {
            "type": "string",
            "enum": [
              "GET",
              "POST",
              "PUT",
              "PATCH",
              "DELETE"
            ]
          },
          "url": {
            "type": "string",
            "minLength": 1,
            "pattern": "^https://[^\\s]+$"
          },
          "purpose": {
            "type": "string",
            "minLength": 1,
            "pattern": "\\S"
          },
          "requestedBySourceFileId": {
            "type": "string",
            "minLength": 1,
            "pattern": "^[A-Za-z][A-Za-z0-9_-]{0,95}$"
          },
          "proposalOnly": {
            "type": "boolean",
            "const": true
          },
          "executed": {
            "type": "boolean",
            "const": false
          }
        }
      }
    },
    "preview": {
      "$schema": "https://json-schema.org/draft/2020-12/schema",
      "title": "Plugin review artifact preview body",
      "type": "object",
      "additionalProperties": false,
      "required": [
        "artifactType",
        "title",
        "summary",
        "renderMode",
        "sections"
      ],
      "properties": {
        "artifactType": {
          "type": "string",
          "const": "pluginReviewArtifact"
        },
        "title": {
          "type": "string",
          "minLength": 1,
          "pattern": "\\S"
        },
        "summary": {
          "type": "string",
          "minLength": 1,
          "pattern": "\\S"
        },
        "renderMode": {
          "type": "string",
          "enum": [
            "markdown",
            "json",
            "text"
          ]
        },
        "sections": {
          "type": "array",
          "minItems": 1,
          "items": {
            "$schema": "https://json-schema.org/draft/2020-12/schema",
            "title": "Plugin review preview section",
            "type": "object",
            "additionalProperties": false,
            "required": [
              "id",
              "title",
              "sourceFileIds",
              "redactionIds",
              "contentFingerprint"
            ],
            "properties": {
              "id": {
                "type": "string",
                "minLength": 1,
                "pattern": "^[A-Za-z][A-Za-z0-9_-]{0,95}$"
              },
              "title": {
                "type": "string",
                "minLength": 1,
                "pattern": "\\S"
              },
              "sourceFileIds": {
                "type": "array",
                "minItems": 1,
                "items": {
                  "type": "string",
                  "minLength": 1,
                  "pattern": "^[A-Za-z][A-Za-z0-9_-]{0,95}$"
                }
              },
              "redactionIds": {
                "type": "array",
                "items": {
                  "type": "string",
                  "minLength": 1,
                  "pattern": "^[A-Za-z][A-Za-z0-9_-]{0,95}$"
                }
              },
              "contentFingerprint": {
                "type": "string",
                "pattern": "^[a-f0-9]{64}$"
              }
            }
          }
        }
      }
    }
  }
}
